{"id": "simpleTextQuestion", "schemaVersion": "1", "version": "1", "meta": {"author": "Someone", "language": "en", "title": "Simple text question", "creationDate": "2020-04-13T14:48:48+0000"}, "questions": [{"id": "q1_text", "text": "Please insert 'test' to see a result.", "type": "text", "optional": true}], "variables": [], "resultCategories": [{"id": "rc_text", "description": "Text", "results": [{"id": "TEXT", "text": "You are able to follow simple instructions", "value": {"==": [{"var": "q1_text.value"}, "test"]}}]}]}